{
  "problem": "The cost of housing in London is too high for people on ordinary incomes.",
  "who_bears_it": "Private renters in London on median or below-median household incomes.",
  "observable_condition": {
    "statement": "Median private rent in London takes about a third of median gross household income.",
    "metric": "Median monthly rent as a share of median gross monthly household income, London",
    "baseline": 0.35,
    "unit": "ratio",
    "source": "assumption"
  },
  "outcome_sought": {
    "statement": "Median private rent in London falls to no more than 30 per cent of median gross household income.",
    "metric": "Median monthly rent as a share of median gross monthly household income, London",
    "target": 0.30,
    "unit": "ratio",
    "by_date": "2035"
  },
  "constraints": [
    "No reliance on a change in national law",
    "No public subsidy in the at-scale economics",
    "Synthetic example: every figure is a placeholder to be replaced with a sourced one"
  ]
}
